{
  "$schema": "../../../schemas/recipe.schema.json",
  "id": "deployment-containers",
  "entry": "docs/recipes/deployment-containers/README.md",
  "triggers": [
    "The application deploys as container images to a host or managed container platform."
  ],
  "replaces": [],
  "packages": { "nuget": [], "npm": [] },
  "projects": [],
  "gates": [
    "Build images from a clean checkout.",
    "Run schema, readiness, smoke, and rollback checks in a deployment environment."
  ]
}
