{
  "$schema": "../../../schemas/recipe.schema.json",
  "id": "caching",
  "entry": "docs/recipes/caching/README.md",
  "triggers": [
    "Measured latency or load shows repeated reads whose staleness can be bounded."
  ],
  "replaces": [],
  "packages": { "nuget": [], "npm": [] },
  "projects": [],
  "gates": [
    "Test hit, miss, expiry, and invalidation behavior.",
    "Measure latency and correctness before and after adoption."
  ]
}
