{
  "$schema": "../../../schemas/recipe.schema.json",
  "id": "acceptance-bdd",
  "entry": "docs/recipes/acceptance-bdd/README.md",
  "triggers": [
    "A critical cross-layer journey benefits from stakeholder-readable executable examples."
  ],
  "replaces": [],
  "packages": {
    "nuget": ["Reqnroll", "Reqnroll.xUnit"],
    "npm": []
  },
  "projects": ["{ProjectName}.Acceptance.Tests"],
  "gates": [
    "Run critical scenarios on every pull request.",
    "Run the complete acceptance project for domain and API changes."
  ]
}
