{
  "$schema": "../../../schemas/recipe.schema.json",
  "id": "persistence-ef-core",
  "entry": "docs/recipes/persistence-ef-core/README.md",
  "triggers": [
    "The application requires relational change tracking, relational navigation mapping, or a supported provider that Marten does not cover."
  ],
  "replaces": [
    "PERSIST.WRITE.001",
    "PERSIST.READ.001",
    "PERSIST.COMMIT.001",
    "PERSIST.EVENTS.001"
  ],
  "packages": {
    "nuget": [
      "Microsoft.EntityFrameworkCore",
      "Npgsql.EntityFrameworkCore.PostgreSQL",
      "EFCore.NamingConventions"
    ],
    "npm": []
  },
  "projects": [],
  "gates": [
    "Generate and review every migration.",
    "Run integration tests against PostgreSQL.",
    "Verify migration application and rollback behavior."
  ]
}
