{
  "$schema": "../../../schemas/recipe.schema.json",
  "id": "realtime",
  "entry": "docs/recipes/realtime/README.md",
  "triggers": [
    "The user must receive server changes without polling within a documented latency target."
  ],
  "replaces": [],
  "packages": { "nuget": [], "npm": [] },
  "projects": [],
  "gates": [
    "Test authorization for connection and subscription.",
    "Test reconnect and missed-event recovery."
  ]
}
